{
  "$schema": "https://json-schema.org/draft/2020-12/schema",
  "$id": "https://lcim.local/schemas/repair-ticket.v2.schema.json",
  "$comment": "Sprint 06 — deterministic repair-ticket conversion record. When a SOL_DIAGNOSE failure response (CAUSE_IDENTIFIED) is compiled into the Sprint-04 worker-ready repair contract (lcim.acceptance-contract via src/contracts/repair.mjs buildRepairContract), this record proves the conversion deterministically: ticketId equals the compiled repairId (derived from the source ask+response, so identical inputs produce identical tickets), sourceAskId/sourceResponseId bind the ticket to exactly one decision exchange, rejectedAcceptanceRefs carries the single diagnosed acceptance criterion (a sideEffectId of the authoritative semantic contract), and conversionDigest is the sha256 over the canonical deterministic conversion payload (decision content excluding instance metadata). The schema uses only the Sprint-00 engine subset; cross-field rules are enforced in src/sol/contracts/validate.mjs (validateRepairTicket).",
  "title": "LCIM V2 deterministic repair-ticket conversion record",
  "type": "object",
  "additionalProperties": false,
  "required": [
    "schemaName",
    "schemaVersion",
    "ticketId",
    "sourceAskId",
    "sourceResponseId",
    "callType",
    "repairId",
    "contractKey",
    "sourceSemanticDigest",
    "rejectedAcceptanceRefs",
    "conversionDigest",
    "compiledAt"
  ],
  "properties": {
    "schemaName": { "const": "lcim.repair-ticket" },
    "schemaVersion": { "const": "2.0.0" },
    "ticketId": { "type": "string", "pattern": "^lcim_repair_[0-9a-f]{32}$" },
    "sourceAskId": { "type": "string", "pattern": "^lcim_sol_ask_[0-9a-f]{32}$" },
    "sourceResponseId": { "type": "string", "pattern": "^lcim_sol_resp_[0-9a-f]{32}$" },
    "callType": { "const": "SOL_DIAGNOSE" },
    "repairId": { "type": "string", "pattern": "^lcim_repair_[0-9a-f]{32}$" },
    "contractKey": { "type": "string", "pattern": "^[a-z0-9][a-z0-9._-]{0,127}$" },
    "sourceSemanticDigest": { "type": "string", "pattern": "^[0-9a-f]{64}$" },
    "rejectedAcceptanceRefs": {
      "type": "array",
      "minItems": 1,
      "maxItems": 1,
      "items": { "type": "string", "pattern": "^se_[0-9a-f]{64}$" }
    },
    "conversionDigest": { "type": "string", "pattern": "^[0-9a-f]{64}$" },
    "compiledAt": {
      "type": "string",
      "pattern": "^[0-9]{4}-[0-9]{2}-[0-9]{2}T[0-9]{2}:[0-9]{2}:[0-9]{2}(\\.[0-9]+)?(Z|[+-][0-9]{2}:[0-9]{2})$"
    }
  }
}
